{
  "schema_version": "1.2.0",
  "audit_id": "202a664b-99b2-44e5-a8e4-c422c9a2c260",
  "url": "https://www.energymin.gov.lk/",
  "normalized_url": "https://www.energymin.gov.lk/",
  "started_at": "2026-09-05T11:47:05.807701+05:30",
  "completed_at": "2026-09-05T11:47:09.477227+05:30",
  "result": {
    "status": "pass",
    "confidence": 1.0,
    "reasons": [
      "dns_resolves: Public DNS resolved"
    ]
  },
  "evidence": [
    {
      "check": "dns",
      "status": "pass",
      "detail": "Public DNS resolved",
      "observed_at": "2026-09-05T11:47:06.265205+05:30"
    },
    {
      "check": "domain_registration",
      "status": "error",
      "detail": "Domain is absent from RDAP",
      "observed_at": "2026-09-05T11:47:06.265248+05:30"
    },
    {
      "check": "tls_expired",
      "status": "fail",
      "detail": "TLS certificate has expired",
      "observed_at": "2026-09-05T11:47:06.393414+05:30"
    },
    {
      "check": "tls_browser_error",
      "status": "fail",
      "detail": "Probe 1: [SSL: CERTIFICATE_VERIFY_FAILED] certificate verify failed: certificate has expired (_ssl.c:1000)",
      "source": "https://www.energymin.gov.lk/",
      "observed_at": "2026-09-05T11:47:09.476550+05:30"
    },
    {
      "check": "tls_browser_error",
      "status": "fail",
      "detail": "Probe 2: [SSL: CERTIFICATE_VERIFY_FAILED] certificate verify failed: certificate has expired (_ssl.c:1000)",
      "source": "http://www.energymin.gov.lk/",
      "observed_at": "2026-09-05T11:47:09.476657+05:30"
    },
    {
      "check": "tls_browser_error",
      "status": "fail",
      "detail": "Probe 3: [SSL: CERTIFICATE_VERIFY_FAILED] certificate verify failed: certificate has expired (_ssl.c:1000)",
      "source": "https://www.energymin.gov.lk/",
      "observed_at": "2026-09-05T11:47:09.476681+05:30"
    },
    {
      "check": "tls_browser_error",
      "status": "fail",
      "detail": "Probe 4: [SSL: CERTIFICATE_VERIFY_FAILED] certificate verify failed: certificate has expired (_ssl.c:1000)",
      "source": "http://www.energymin.gov.lk/",
      "observed_at": "2026-09-05T11:47:09.476696+05:30"
    }
  ],
  "observations": [
    {
      "host": "www.energymin.gov.lk",
      "addresses": [
        "222.165.190.235"
      ],
      "status": "resolved",
      "detail": "Public DNS resolved"
    },
    {
      "domain": "energymin.gov.lk",
      "status": "unknown",
      "expires_at": null,
      "detail": "Domain is absent from RDAP"
    },
    {
      "host": "www.energymin.gov.lk",
      "status": "expired",
      "expires_at": "2026-09-04T12:06:11+05:30",
      "hostname_valid": true,
      "detail": "TLS certificate has expired"
    },
    {
      "url": "https://www.energymin.gov.lk/",
      "status_code": null,
      "final_url": null,
      "redirects": [],
      "elapsed_ms": null,
      "content_type": null,
      "error": "[SSL: CERTIFICATE_VERIFY_FAILED] certificate verify failed: certificate has expired (_ssl.c:1000)"
    },
    {
      "url": "http://www.energymin.gov.lk/",
      "status_code": null,
      "final_url": null,
      "redirects": [],
      "elapsed_ms": null,
      "content_type": null,
      "error": "[SSL: CERTIFICATE_VERIFY_FAILED] certificate verify failed: certificate has expired (_ssl.c:1000)"
    },
    {
      "url": "https://www.energymin.gov.lk/",
      "status_code": null,
      "final_url": null,
      "redirects": [],
      "elapsed_ms": null,
      "content_type": null,
      "error": "[SSL: CERTIFICATE_VERIFY_FAILED] certificate verify failed: certificate has expired (_ssl.c:1000)"
    },
    {
      "url": "http://www.energymin.gov.lk/",
      "status_code": null,
      "final_url": null,
      "redirects": [],
      "elapsed_ms": null,
      "content_type": null,
      "error": "[SSL: CERTIFICATE_VERIFY_FAILED] certificate verify failed: certificate has expired (_ssl.c:1000)"
    }
  ],
  "snapshots": [],
  "reviewer_decisions": [],
  "levels": [
    {
      "level": 0,
      "description": "A site is classified as `Level 0` when it is unavailable or unusable, or when there is not enough evidence to establish that it meets `Level 1`.",
      "status": "pass",
      "reason": "Baseline website grade",
      "executed": true,
      "checks": []
    },
    {
      "level": 1,
      "description": "To pass `Level 1`, the website must be available, usable, and clearly associated with the government institution. It must load reliably with valid DNS, HTTP, and TLS behavior.",
      "status": "pass",
      "reason": "TLS certificate expired but the site remains available; kept at Level 1",
      "executed": true,
      "checks": [
        {
          "name": "dns_resolves",
          "level": 1,
          "status": "pass",
          "reason": "Public DNS resolved"
        },
        {
          "name": "domain_not_parked",
          "level": 1,
          "status": "inconclusive",
          "reason": "No usable page was inspected"
        },
        {
          "name": "site_not_defaced",
          "level": 1,
          "status": "inconclusive",
          "reason": "No usable page was inspected"
        },
        {
          "name": "content_relevant",
          "level": 1,
          "status": "inconclusive",
          "reason": "No usable page was inspected"
        },
        {
          "name": "hosting_configured",
          "level": 1,
          "status": "inconclusive",
          "reason": "No usable page was inspected"
        },
        {
          "name": "http_available",
          "level": 1,
          "status": "inconclusive",
          "reason": "HTTP checks did not run"
        },
        {
          "name": "redirect_related",
          "level": 1,
          "status": "inconclusive",
          "reason": "No redirect result was available"
        },
        {
          "name": "tls_browser_trusted",
          "level": 1,
          "status": "fail",
          "reason": "Probe 1: [SSL: CERTIFICATE_VERIFY_FAILED] certificate verify failed: certificate has expired (_ssl.c:1000)"
        },
        {
          "name": "tls_not_expired",
          "level": 1,
          "status": "fail",
          "reason": "TLS certificate has expired"
        },
        {
          "name": "tls_hostname_matches",
          "level": 1,
          "status": "inconclusive",
          "reason": "TLS hostname check did not run"
        }
      ]
    },
    {
      "level": 2,
      "description": "To pass `Level 2`, citizens must be able to identify and contact the correct office for the service they need.",
      "status": "inconclusive",
      "reason": "No passing postal address evidence found; No phone or email evidence found; No passing named responsibility evidence found; No passing email on the site domain evidence found; No passing email domain has mx records evidence found",
      "executed": true,
      "checks": [
        {
          "name": "postal_address",
          "level": 2,
          "status": "inconclusive",
          "reason": "No passing postal address evidence found"
        },
        {
          "name": "reachable_contacts",
          "level": 2,
          "status": "inconclusive",
          "reason": "No phone or email evidence found"
        },
        {
          "name": "named_responsibility",
          "level": 2,
          "status": "inconclusive",
          "reason": "No passing named responsibility evidence found"
        },
        {
          "name": "email_in_site_domain",
          "level": 2,
          "status": "inconclusive",
          "reason": "No passing email on the site domain evidence found"
        },
        {
          "name": "email_domain_has_mx",
          "level": 2,
          "status": "inconclusive",
          "reason": "No passing email domain has mx records evidence found"
        }
      ]
    },
    {
      "level": 3,
      "description": "To pass `Level 3`, citizens must find complete and current instructions, requirements, fees, times, and usable forms.",
      "status": "inconclusive",
      "reason": "Not run because Level 2 did not pass",
      "executed": false,
      "checks": []
    },
    {
      "level": 4,
      "description": "To pass `Level 4`, citizens must be able to complete, pay for, track, and receive the outcome of a service online.",
      "status": "inconclusive",
      "reason": "Not run because Level 3 did not pass",
      "executed": false,
      "checks": []
    },
    {
      "level": 5,
      "description": "To pass `Level 5`, services must be connected across agencies, proactive for eligible citizens, explainable, and accountable.",
      "status": "inconclusive",
      "reason": "Not run because Level 4 did not pass",
      "executed": false,
      "checks": []
    }
  ]
}
