{
  "schema_version": "1.2.0",
  "audit_id": "f30bec2d-b40c-4b78-9883-ecc79be07940",
  "url": "https://aib.gov.lk/aib/",
  "normalized_url": "https://aib.gov.lk/aib/",
  "started_at": "2026-09-05T10:31:15.396934+05:30",
  "completed_at": "2026-09-05T10:31:27.210835+05:30",
  "result": {
    "status": "fail",
    "confidence": 1.0,
    "reasons": [
      "http_available: Every repeated HTTP probe failed: [404, 404, 404, 404]"
    ]
  },
  "evidence": [
    {
      "check": "dns",
      "status": "pass",
      "detail": "Public DNS resolved",
      "observed_at": "2026-09-05T10:31:16.742498+05:30"
    },
    {
      "check": "domain_registration",
      "status": "error",
      "detail": "Domain is absent from RDAP",
      "observed_at": "2026-09-05T10:31:16.742517+05:30"
    },
    {
      "check": "tls",
      "status": "pass",
      "detail": "TLS certificate valid",
      "observed_at": "2026-09-05T10:31:17.819458+05:30"
    },
    {
      "check": "http",
      "status": "fail",
      "detail": "Probe 1: HTTP 404 at https://aib.gov.lk/aib",
      "source": "https://aib.gov.lk/aib/",
      "observed_at": "2026-09-05T10:31:27.207886+05:30"
    },
    {
      "check": "http",
      "status": "fail",
      "detail": "Probe 2: HTTP 404 at http://aib.gov.lk/aib/",
      "source": "http://aib.gov.lk/aib/",
      "observed_at": "2026-09-05T10:31:27.207916+05:30"
    },
    {
      "check": "http",
      "status": "fail",
      "detail": "Probe 3: HTTP 404 at https://aib.gov.lk/aib",
      "source": "https://aib.gov.lk/aib/",
      "observed_at": "2026-09-05T10:31:27.207923+05:30"
    },
    {
      "check": "http",
      "status": "fail",
      "detail": "Probe 4: HTTP 404 at http://aib.gov.lk/aib/",
      "source": "http://aib.gov.lk/aib/",
      "observed_at": "2026-09-05T10:31:27.207928+05:30"
    },
    {
      "check": "persistent_http_failure",
      "status": "fail",
      "detail": "Every repeated HTTP probe failed: [404, 404, 404, 404]",
      "observed_at": "2026-09-05T10:31:27.208693+05:30"
    }
  ],
  "observations": [
    {
      "host": "aib.gov.lk",
      "addresses": [
        "124.43.163.251"
      ],
      "status": "resolved",
      "detail": "Public DNS resolved"
    },
    {
      "domain": "aib.gov.lk",
      "status": "unknown",
      "expires_at": null,
      "detail": "Domain is absent from RDAP"
    },
    {
      "host": "aib.gov.lk",
      "status": "valid",
      "expires_at": "2026-11-25T06:23:53+05:30",
      "hostname_valid": true,
      "detail": "TLS certificate valid"
    },
    {
      "url": "https://aib.gov.lk/aib/",
      "status_code": 404,
      "final_url": "https://aib.gov.lk/aib",
      "redirects": [
        "https://aib.gov.lk/aib"
      ],
      "elapsed_ms": 1839,
      "content_type": "application/json; charset=UTF-8",
      "error": null
    },
    {
      "url": "http://aib.gov.lk/aib/",
      "status_code": 404,
      "final_url": "http://aib.gov.lk/aib/",
      "redirects": [],
      "elapsed_ms": 1116,
      "content_type": "text/html; charset=iso-8859-1",
      "error": null
    },
    {
      "url": "https://aib.gov.lk/aib/",
      "status_code": 404,
      "final_url": "https://aib.gov.lk/aib",
      "redirects": [
        "https://aib.gov.lk/aib"
      ],
      "elapsed_ms": 1803,
      "content_type": "application/json; charset=UTF-8",
      "error": null
    },
    {
      "url": "http://aib.gov.lk/aib/",
      "status_code": 404,
      "final_url": "http://aib.gov.lk/aib/",
      "redirects": [],
      "elapsed_ms": 1139,
      "content_type": "text/html; charset=iso-8859-1",
      "error": null
    }
  ],
  "snapshots": [
    {
      "url": "https://aib.gov.lk/aib",
      "path": "audit.output/aib.gov.lk/20260905.1031/snapshots/page-01-12ae32cb1ec0.html",
      "sha256": "12ae32cb1ec02d01eda3581b127c1fee3b0dc53572ed6baf239721a03d82e126",
      "bytes": 2
    },
    {
      "url": "http://aib.gov.lk/aib/",
      "path": "audit.output/aib.gov.lk/20260905.1031/snapshots/page-02-80c3fe2ae106.html",
      "sha256": "80c3fe2ae1062abf56456f52518bd670f9ec3917b7f85e152b347ac6b6faf880",
      "bytes": 196
    },
    {
      "url": "https://aib.gov.lk/aib",
      "path": "audit.output/aib.gov.lk/20260905.1031/snapshots/page-03-12ae32cb1ec0.html",
      "sha256": "12ae32cb1ec02d01eda3581b127c1fee3b0dc53572ed6baf239721a03d82e126",
      "bytes": 2
    },
    {
      "url": "http://aib.gov.lk/aib/",
      "path": "audit.output/aib.gov.lk/20260905.1031/snapshots/page-04-80c3fe2ae106.html",
      "sha256": "80c3fe2ae1062abf56456f52518bd670f9ec3917b7f85e152b347ac6b6faf880",
      "bytes": 196
    }
  ],
  "reviewer_decisions": [],
  "levels": [
    {
      "level": 0,
      "description": "A site is classified as `Level 0` when it is unavailable or unusable, or when there is not enough evidence to establish that it meets `Level 1`.",
      "status": "pass",
      "reason": "Baseline website grade",
      "executed": true,
      "checks": []
    },
    {
      "level": 1,
      "description": "To pass `Level 1`, the website must be available, usable, and clearly associated with the government institution. It must load reliably with valid DNS, HTTP, and TLS behavior.",
      "status": "fail",
      "reason": "Every repeated HTTP probe failed: [404, 404, 404, 404]",
      "executed": true,
      "checks": [
        {
          "name": "dns_resolves",
          "level": 1,
          "status": "pass",
          "reason": "Public DNS resolved"
        },
        {
          "name": "domain_not_parked",
          "level": 1,
          "status": "inconclusive",
          "reason": "No usable page was inspected"
        },
        {
          "name": "site_not_defaced",
          "level": 1,
          "status": "inconclusive",
          "reason": "No usable page was inspected"
        },
        {
          "name": "content_relevant",
          "level": 1,
          "status": "inconclusive",
          "reason": "No usable page was inspected"
        },
        {
          "name": "hosting_configured",
          "level": 1,
          "status": "inconclusive",
          "reason": "No usable page was inspected"
        },
        {
          "name": "http_available",
          "level": 1,
          "status": "fail",
          "reason": "Every repeated HTTP probe failed: [404, 404, 404, 404]"
        },
        {
          "name": "redirect_related",
          "level": 1,
          "status": "inconclusive",
          "reason": "No redirect result was available"
        },
        {
          "name": "tls_browser_trusted",
          "level": 1,
          "status": "inconclusive",
          "reason": "Browser TLS check did not complete"
        },
        {
          "name": "tls_not_expired",
          "level": 1,
          "status": "pass",
          "reason": "TLS certificate valid"
        },
        {
          "name": "tls_hostname_matches",
          "level": 1,
          "status": "pass",
          "reason": "TLS certificate valid"
        }
      ]
    },
    {
      "level": 2,
      "description": "To pass `Level 2`, citizens must be able to identify and contact the correct office for the service they need.",
      "status": "inconclusive",
      "reason": "Not run because Level 1 did not pass",
      "executed": false,
      "checks": []
    },
    {
      "level": 3,
      "description": "To pass `Level 3`, citizens must find complete and current instructions, requirements, fees, times, and usable forms.",
      "status": "inconclusive",
      "reason": "Not run because Level 2 did not pass",
      "executed": false,
      "checks": []
    },
    {
      "level": 4,
      "description": "To pass `Level 4`, citizens must be able to complete, pay for, track, and receive the outcome of a service online.",
      "status": "inconclusive",
      "reason": "Not run because Level 3 did not pass",
      "executed": false,
      "checks": []
    },
    {
      "level": 5,
      "description": "To pass `Level 5`, services must be connected across agencies, proactive for eligible citizens, explainable, and accountable.",
      "status": "inconclusive",
      "reason": "Not run because Level 4 did not pass",
      "executed": false,
      "checks": []
    }
  ]
}
