{
  "schema_version": "1.2.0",
  "audit_id": "b6850158-27d8-4659-aadb-f38b26db7e07",
  "url": "https://dea.gov.lk/",
  "normalized_url": "https://dea.gov.lk/",
  "started_at": "2026-09-05T10:44:10.964685+05:30",
  "completed_at": "2026-09-05T10:46:23.360624+05:30",
  "result": {
    "status": "inconclusive",
    "confidence": 0.5,
    "reasons": [
      "domain_not_parked: No usable page was inspected",
      "site_not_defaced: No usable page was inspected",
      "content_relevant: No usable page was inspected",
      "hosting_configured: No usable page was inspected",
      "http_available: An HTTP probe was transient",
      "redirect_related: No redirect result was available",
      "tls_browser_trusted: Browser TLS check did not complete"
    ]
  },
  "evidence": [
    {
      "check": "dns",
      "status": "pass",
      "detail": "Public DNS resolved",
      "observed_at": "2026-09-05T10:44:12.971553+05:30"
    },
    {
      "check": "domain_registration",
      "status": "error",
      "detail": "Domain is absent from RDAP",
      "observed_at": "2026-09-05T10:44:12.971581+05:30"
    },
    {
      "check": "tls",
      "status": "pass",
      "detail": "TLS certificate valid",
      "observed_at": "2026-09-05T10:44:14.631011+05:30"
    },
    {
      "check": "http",
      "status": "error",
      "detail": "Probe 1: The read operation timed out",
      "source": "https://dea.gov.lk/",
      "observed_at": "2026-09-05T10:46:23.360321+05:30"
    },
    {
      "check": "http",
      "status": "error",
      "detail": "Probe 2: The read operation timed out",
      "source": "http://dea.gov.lk/",
      "observed_at": "2026-09-05T10:46:23.360360+05:30"
    },
    {
      "check": "http",
      "status": "error",
      "detail": "Probe 3: The read operation timed out",
      "source": "https://dea.gov.lk/",
      "observed_at": "2026-09-05T10:46:23.360369+05:30"
    },
    {
      "check": "http",
      "status": "error",
      "detail": "Probe 4: The read operation timed out",
      "source": "http://dea.gov.lk/",
      "observed_at": "2026-09-05T10:46:23.360375+05:30"
    }
  ],
  "observations": [
    {
      "host": "dea.gov.lk",
      "addresses": [
        "43.224.126.115"
      ],
      "status": "resolved",
      "detail": "Public DNS resolved"
    },
    {
      "domain": "dea.gov.lk",
      "status": "unknown",
      "expires_at": null,
      "detail": "Domain is absent from RDAP"
    },
    {
      "host": "dea.gov.lk",
      "status": "valid",
      "expires_at": "2026-12-02T08:31:50+05:30",
      "hostname_valid": true,
      "detail": "TLS certificate valid"
    },
    {
      "url": "https://dea.gov.lk/",
      "status_code": null,
      "final_url": null,
      "redirects": [],
      "elapsed_ms": null,
      "content_type": null,
      "error": "The read operation timed out"
    },
    {
      "url": "http://dea.gov.lk/",
      "status_code": null,
      "final_url": null,
      "redirects": [],
      "elapsed_ms": null,
      "content_type": null,
      "error": "The read operation timed out"
    },
    {
      "url": "https://dea.gov.lk/",
      "status_code": null,
      "final_url": null,
      "redirects": [],
      "elapsed_ms": null,
      "content_type": null,
      "error": "The read operation timed out"
    },
    {
      "url": "http://dea.gov.lk/",
      "status_code": null,
      "final_url": null,
      "redirects": [],
      "elapsed_ms": null,
      "content_type": null,
      "error": "The read operation timed out"
    }
  ],
  "snapshots": [],
  "reviewer_decisions": [],
  "levels": [
    {
      "level": 0,
      "description": "A site is classified as `Level 0` when it is unavailable or unusable, or when there is not enough evidence to establish that it meets `Level 1`.",
      "status": "pass",
      "reason": "Baseline website grade",
      "executed": true,
      "checks": []
    },
    {
      "level": 1,
      "description": "To pass `Level 1`, the website must be available, usable, and clearly associated with the government institution. It must load reliably with valid DNS, HTTP, and TLS behavior.",
      "status": "inconclusive",
      "reason": "No usable page was inspected; No usable page was inspected; No usable page was inspected; No usable page was inspected; An HTTP probe was transient; No redirect result was available; Browser TLS check did not complete",
      "executed": true,
      "checks": [
        {
          "name": "dns_resolves",
          "level": 1,
          "status": "pass",
          "reason": "Public DNS resolved"
        },
        {
          "name": "domain_not_parked",
          "level": 1,
          "status": "inconclusive",
          "reason": "No usable page was inspected"
        },
        {
          "name": "site_not_defaced",
          "level": 1,
          "status": "inconclusive",
          "reason": "No usable page was inspected"
        },
        {
          "name": "content_relevant",
          "level": 1,
          "status": "inconclusive",
          "reason": "No usable page was inspected"
        },
        {
          "name": "hosting_configured",
          "level": 1,
          "status": "inconclusive",
          "reason": "No usable page was inspected"
        },
        {
          "name": "http_available",
          "level": 1,
          "status": "inconclusive",
          "reason": "An HTTP probe was transient"
        },
        {
          "name": "redirect_related",
          "level": 1,
          "status": "inconclusive",
          "reason": "No redirect result was available"
        },
        {
          "name": "tls_browser_trusted",
          "level": 1,
          "status": "inconclusive",
          "reason": "Browser TLS check did not complete"
        },
        {
          "name": "tls_not_expired",
          "level": 1,
          "status": "pass",
          "reason": "TLS certificate valid"
        },
        {
          "name": "tls_hostname_matches",
          "level": 1,
          "status": "pass",
          "reason": "TLS certificate valid"
        }
      ]
    },
    {
      "level": 2,
      "description": "To pass `Level 2`, citizens must be able to identify and contact the correct office for the service they need.",
      "status": "inconclusive",
      "reason": "Not run because Level 1 did not pass",
      "executed": false,
      "checks": []
    },
    {
      "level": 3,
      "description": "To pass `Level 3`, citizens must find complete and current instructions, requirements, fees, times, and usable forms.",
      "status": "inconclusive",
      "reason": "Not run because Level 2 did not pass",
      "executed": false,
      "checks": []
    },
    {
      "level": 4,
      "description": "To pass `Level 4`, citizens must be able to complete, pay for, track, and receive the outcome of a service online.",
      "status": "inconclusive",
      "reason": "Not run because Level 3 did not pass",
      "executed": false,
      "checks": []
    },
    {
      "level": 5,
      "description": "To pass `Level 5`, services must be connected across agencies, proactive for eligible citizens, explainable, and accountable.",
      "status": "inconclusive",
      "reason": "Not run because Level 4 did not pass",
      "executed": false,
      "checks": []
    }
  ]
}
