{
  "schema_version": "1.2.0",
  "audit_id": "3eefd2ad-624d-4803-b00f-1c4b5835d31e",
  "url": "https://www.powermin.gov.lk/",
  "normalized_url": "https://www.powermin.gov.lk/",
  "started_at": "2026-09-05T11:46:32.885262+05:30",
  "completed_at": "2026-09-05T11:47:05.793931+05:30",
  "result": {
    "status": "inconclusive",
    "confidence": 0.5,
    "reasons": [
      "domain_not_parked: No usable page was inspected",
      "site_not_defaced: No usable page was inspected",
      "content_relevant: No usable page was inspected",
      "hosting_configured: No usable page was inspected",
      "http_available: An HTTP probe was transient",
      "redirect_related: No redirect result was available",
      "tls_browser_trusted: Browser TLS check did not complete",
      "tls_not_expired: [Errno 51] Network is unreachable",
      "tls_hostname_matches: [Errno 51] Network is unreachable"
    ]
  },
  "evidence": [
    {
      "check": "dns",
      "status": "pass",
      "detail": "Public DNS resolved",
      "observed_at": "2026-09-05T11:46:33.364572+05:30"
    },
    {
      "check": "domain_registration",
      "status": "error",
      "detail": "Domain is absent from RDAP",
      "observed_at": "2026-09-05T11:46:33.364596+05:30"
    },
    {
      "check": "tls",
      "status": "error",
      "detail": "[Errno 51] Network is unreachable",
      "observed_at": "2026-09-05T11:46:38.514257+05:30"
    },
    {
      "check": "http",
      "status": "error",
      "detail": "Probe 1: [Errno 51] Network is unreachable",
      "source": "https://www.powermin.gov.lk/",
      "observed_at": "2026-09-05T11:47:05.793442+05:30"
    },
    {
      "check": "http",
      "status": "error",
      "detail": "Probe 2: [Errno 51] Network is unreachable",
      "source": "http://www.powermin.gov.lk/",
      "observed_at": "2026-09-05T11:47:05.793489+05:30"
    },
    {
      "check": "http",
      "status": "error",
      "detail": "Probe 3: [Errno 51] Network is unreachable",
      "source": "https://www.powermin.gov.lk/",
      "observed_at": "2026-09-05T11:47:05.793505+05:30"
    },
    {
      "check": "http",
      "status": "error",
      "detail": "Probe 4: [Errno 51] Network is unreachable",
      "source": "http://www.powermin.gov.lk/",
      "observed_at": "2026-09-05T11:47:05.793518+05:30"
    }
  ],
  "observations": [
    {
      "host": "www.powermin.gov.lk",
      "addresses": [
        "103.1.179.75"
      ],
      "status": "resolved",
      "detail": "Public DNS resolved"
    },
    {
      "domain": "powermin.gov.lk",
      "status": "unknown",
      "expires_at": null,
      "detail": "Domain is absent from RDAP"
    },
    {
      "host": "www.powermin.gov.lk",
      "status": "error",
      "expires_at": null,
      "hostname_valid": null,
      "detail": "[Errno 51] Network is unreachable"
    },
    {
      "url": "https://www.powermin.gov.lk/",
      "status_code": null,
      "final_url": null,
      "redirects": [],
      "elapsed_ms": null,
      "content_type": null,
      "error": "[Errno 51] Network is unreachable"
    },
    {
      "url": "http://www.powermin.gov.lk/",
      "status_code": null,
      "final_url": null,
      "redirects": [],
      "elapsed_ms": null,
      "content_type": null,
      "error": "[Errno 51] Network is unreachable"
    },
    {
      "url": "https://www.powermin.gov.lk/",
      "status_code": null,
      "final_url": null,
      "redirects": [],
      "elapsed_ms": null,
      "content_type": null,
      "error": "[Errno 51] Network is unreachable"
    },
    {
      "url": "http://www.powermin.gov.lk/",
      "status_code": null,
      "final_url": null,
      "redirects": [],
      "elapsed_ms": null,
      "content_type": null,
      "error": "[Errno 51] Network is unreachable"
    }
  ],
  "snapshots": [],
  "reviewer_decisions": [],
  "levels": [
    {
      "level": 0,
      "description": "A site is classified as `Level 0` when it is unavailable or unusable, or when there is not enough evidence to establish that it meets `Level 1`.",
      "status": "pass",
      "reason": "Baseline website grade",
      "executed": true,
      "checks": []
    },
    {
      "level": 1,
      "description": "To pass `Level 1`, the website must be available, usable, and clearly associated with the government institution. It must load reliably with valid DNS, HTTP, and TLS behavior.",
      "status": "inconclusive",
      "reason": "No usable page was inspected; No usable page was inspected; No usable page was inspected; No usable page was inspected; An HTTP probe was transient; No redirect result was available; Browser TLS check did not complete; [Errno 51] Network is unreachable; [Errno 51] Network is unreachable",
      "executed": true,
      "checks": [
        {
          "name": "dns_resolves",
          "level": 1,
          "status": "pass",
          "reason": "Public DNS resolved"
        },
        {
          "name": "domain_not_parked",
          "level": 1,
          "status": "inconclusive",
          "reason": "No usable page was inspected"
        },
        {
          "name": "site_not_defaced",
          "level": 1,
          "status": "inconclusive",
          "reason": "No usable page was inspected"
        },
        {
          "name": "content_relevant",
          "level": 1,
          "status": "inconclusive",
          "reason": "No usable page was inspected"
        },
        {
          "name": "hosting_configured",
          "level": 1,
          "status": "inconclusive",
          "reason": "No usable page was inspected"
        },
        {
          "name": "http_available",
          "level": 1,
          "status": "inconclusive",
          "reason": "An HTTP probe was transient"
        },
        {
          "name": "redirect_related",
          "level": 1,
          "status": "inconclusive",
          "reason": "No redirect result was available"
        },
        {
          "name": "tls_browser_trusted",
          "level": 1,
          "status": "inconclusive",
          "reason": "Browser TLS check did not complete"
        },
        {
          "name": "tls_not_expired",
          "level": 1,
          "status": "inconclusive",
          "reason": "[Errno 51] Network is unreachable"
        },
        {
          "name": "tls_hostname_matches",
          "level": 1,
          "status": "inconclusive",
          "reason": "[Errno 51] Network is unreachable"
        }
      ]
    },
    {
      "level": 2,
      "description": "To pass `Level 2`, citizens must be able to identify and contact the correct office for the service they need.",
      "status": "inconclusive",
      "reason": "Not run because Level 1 did not pass",
      "executed": false,
      "checks": []
    },
    {
      "level": 3,
      "description": "To pass `Level 3`, citizens must find complete and current instructions, requirements, fees, times, and usable forms.",
      "status": "inconclusive",
      "reason": "Not run because Level 2 did not pass",
      "executed": false,
      "checks": []
    },
    {
      "level": 4,
      "description": "To pass `Level 4`, citizens must be able to complete, pay for, track, and receive the outcome of a service online.",
      "status": "inconclusive",
      "reason": "Not run because Level 3 did not pass",
      "executed": false,
      "checks": []
    },
    {
      "level": 5,
      "description": "To pass `Level 5`, services must be connected across agencies, proactive for eligible citizens, explainable, and accountable.",
      "status": "inconclusive",
      "reason": "Not run because Level 4 did not pass",
      "executed": false,
      "checks": []
    }
  ]
}
