{
  "schema_version": "1.2.0",
  "audit_id": "3783937b-be62-47b9-95dd-dd62e197e800",
  "url": "http://www.portmin.gov.lk/",
  "normalized_url": "http://www.portmin.gov.lk/",
  "started_at": "2026-09-05T11:33:57.496482+05:30",
  "completed_at": "2026-09-05T11:34:01.243123+05:30",
  "result": {
    "status": "pass",
    "confidence": 1.0,
    "reasons": [
      "dns_resolves: Public DNS resolved",
      "domain_not_parked: No parked-domain marker found",
      "site_not_defaced: No defacement marker found",
      "content_relevant: No unrelated-content marker found",
      "hosting_configured: No generic-hosting marker found",
      "http_available: HTTP probes did not all fail",
      "redirect_related: No unrelated redirect found"
    ]
  },
  "evidence": [
    {
      "check": "dns",
      "status": "pass",
      "detail": "Public DNS resolved",
      "observed_at": "2026-09-05T11:33:58.145433+05:30"
    },
    {
      "check": "domain_registration",
      "status": "error",
      "detail": "Domain is absent from RDAP",
      "observed_at": "2026-09-05T11:33:58.145460+05:30"
    },
    {
      "check": "tls_expired",
      "status": "fail",
      "detail": "TLS certificate has expired",
      "observed_at": "2026-09-05T11:33:58.176444+05:30"
    },
    {
      "check": "tls_browser_error",
      "status": "fail",
      "detail": "Probe 1: [SSL: CERTIFICATE_VERIFY_FAILED] certificate verify failed: self-signed certificate (_ssl.c:1000)",
      "source": "https://www.portmin.gov.lk/",
      "observed_at": "2026-09-05T11:34:01.238207+05:30"
    },
    {
      "check": "http",
      "status": "pass",
      "detail": "Probe 2: HTTP 200 at http://www.portmin.gov.lk/",
      "source": "http://www.portmin.gov.lk/",
      "observed_at": "2026-09-05T11:34:01.238233+05:30"
    },
    {
      "check": "tls_browser_error",
      "status": "fail",
      "detail": "Probe 3: [SSL: CERTIFICATE_VERIFY_FAILED] certificate verify failed: self-signed certificate (_ssl.c:1000)",
      "source": "https://www.portmin.gov.lk/",
      "observed_at": "2026-09-05T11:34:01.238241+05:30"
    },
    {
      "check": "http",
      "status": "pass",
      "detail": "Probe 4: HTTP 200 at http://www.portmin.gov.lk/",
      "source": "http://www.portmin.gov.lk/",
      "observed_at": "2026-09-05T11:34:01.238252+05:30"
    },
    {
      "check": "email_in_site_domain",
      "status": "error",
      "detail": "No published email address to compare"
    },
    {
      "check": "email_domain_has_mx",
      "status": "error",
      "detail": "No published email address to check"
    }
  ],
  "observations": [
    {
      "host": "www.portmin.gov.lk",
      "addresses": [
        "124.43.161.195"
      ],
      "status": "resolved",
      "detail": "Public DNS resolved"
    },
    {
      "domain": "portmin.gov.lk",
      "status": "unknown",
      "expires_at": null,
      "detail": "Domain is absent from RDAP"
    },
    {
      "host": "www.portmin.gov.lk",
      "status": "expired",
      "expires_at": "2021-04-03T16:39:47+05:30",
      "hostname_valid": false,
      "detail": "TLS certificate has expired"
    },
    {
      "url": "https://www.portmin.gov.lk/",
      "status_code": null,
      "final_url": null,
      "redirects": [],
      "elapsed_ms": null,
      "content_type": null,
      "error": "[SSL: CERTIFICATE_VERIFY_FAILED] certificate verify failed: self-signed certificate (_ssl.c:1000)"
    },
    {
      "url": "http://www.portmin.gov.lk/",
      "status_code": 200,
      "final_url": "http://www.portmin.gov.lk/",
      "redirects": [],
      "elapsed_ms": 153,
      "content_type": "text/html; charset=UTF-8",
      "error": null
    },
    {
      "url": "https://www.portmin.gov.lk/",
      "status_code": null,
      "final_url": null,
      "redirects": [],
      "elapsed_ms": null,
      "content_type": null,
      "error": "[SSL: CERTIFICATE_VERIFY_FAILED] certificate verify failed: self-signed certificate (_ssl.c:1000)"
    },
    {
      "url": "http://www.portmin.gov.lk/",
      "status_code": 200,
      "final_url": "http://www.portmin.gov.lk/",
      "redirects": [],
      "elapsed_ms": 26,
      "content_type": "text/html; charset=UTF-8",
      "error": null
    }
  ],
  "snapshots": [
    {
      "url": "http://www.portmin.gov.lk/",
      "path": "audit.output/www.portmin.gov.lk/20260905.1133/snapshots/page-01-55fe1eee74bd.html",
      "sha256": "55fe1eee74bd7c235005d18af85c96084b6ab68bfb9419df4bdb1d64298f8c06",
      "bytes": 2882
    },
    {
      "url": "http://www.portmin.gov.lk/",
      "path": "audit.output/www.portmin.gov.lk/20260905.1133/snapshots/page-02-55fe1eee74bd.html",
      "sha256": "55fe1eee74bd7c235005d18af85c96084b6ab68bfb9419df4bdb1d64298f8c06",
      "bytes": 2882
    }
  ],
  "reviewer_decisions": [],
  "levels": [
    {
      "level": 0,
      "description": "A site is classified as `Level 0` when it is unavailable or unusable, or when there is not enough evidence to establish that it meets `Level 1`.",
      "status": "pass",
      "reason": "Baseline website grade",
      "executed": true,
      "checks": []
    },
    {
      "level": 1,
      "description": "To pass `Level 1`, the website must be available, usable, and clearly associated with the government institution. It must load reliably with valid DNS, HTTP, and TLS behavior.",
      "status": "pass",
      "reason": "TLS certificate expired but the site remains available; kept at Level 1",
      "executed": true,
      "checks": [
        {
          "name": "dns_resolves",
          "level": 1,
          "status": "pass",
          "reason": "Public DNS resolved"
        },
        {
          "name": "domain_not_parked",
          "level": 1,
          "status": "pass",
          "reason": "No parked-domain marker found"
        },
        {
          "name": "site_not_defaced",
          "level": 1,
          "status": "pass",
          "reason": "No defacement marker found"
        },
        {
          "name": "content_relevant",
          "level": 1,
          "status": "pass",
          "reason": "No unrelated-content marker found"
        },
        {
          "name": "hosting_configured",
          "level": 1,
          "status": "pass",
          "reason": "No generic-hosting marker found"
        },
        {
          "name": "http_available",
          "level": 1,
          "status": "pass",
          "reason": "HTTP probes did not all fail"
        },
        {
          "name": "redirect_related",
          "level": 1,
          "status": "pass",
          "reason": "No unrelated redirect found"
        },
        {
          "name": "tls_browser_trusted",
          "level": 1,
          "status": "fail",
          "reason": "Probe 1: [SSL: CERTIFICATE_VERIFY_FAILED] certificate verify failed: self-signed certificate (_ssl.c:1000)"
        },
        {
          "name": "tls_not_expired",
          "level": 1,
          "status": "fail",
          "reason": "TLS certificate has expired"
        },
        {
          "name": "tls_hostname_matches",
          "level": 1,
          "status": "inconclusive",
          "reason": "TLS hostname check did not run"
        }
      ]
    },
    {
      "level": 2,
      "description": "To pass `Level 2`, citizens must be able to identify and contact the correct office for the service they need.",
      "status": "inconclusive",
      "reason": "No passing postal address evidence found; No phone or email evidence found; No passing named responsibility evidence found; No passing email on the site domain evidence found; No passing email domain has mx records evidence found",
      "executed": true,
      "checks": [
        {
          "name": "postal_address",
          "level": 2,
          "status": "inconclusive",
          "reason": "No passing postal address evidence found"
        },
        {
          "name": "reachable_contacts",
          "level": 2,
          "status": "inconclusive",
          "reason": "No phone or email evidence found"
        },
        {
          "name": "named_responsibility",
          "level": 2,
          "status": "inconclusive",
          "reason": "No passing named responsibility evidence found"
        },
        {
          "name": "email_in_site_domain",
          "level": 2,
          "status": "inconclusive",
          "reason": "No passing email on the site domain evidence found"
        },
        {
          "name": "email_domain_has_mx",
          "level": 2,
          "status": "inconclusive",
          "reason": "No passing email domain has mx records evidence found"
        }
      ]
    },
    {
      "level": 3,
      "description": "To pass `Level 3`, citizens must find complete and current instructions, requirements, fees, times, and usable forms.",
      "status": "inconclusive",
      "reason": "Not run because Level 2 did not pass",
      "executed": false,
      "checks": []
    },
    {
      "level": 4,
      "description": "To pass `Level 4`, citizens must be able to complete, pay for, track, and receive the outcome of a service online.",
      "status": "inconclusive",
      "reason": "Not run because Level 3 did not pass",
      "executed": false,
      "checks": []
    },
    {
      "level": 5,
      "description": "To pass `Level 5`, services must be connected across agencies, proactive for eligible citizens, explainable, and accountable.",
      "status": "inconclusive",
      "reason": "Not run because Level 4 did not pass",
      "executed": false,
      "checks": []
    }
  ]
}
