{
  "schema_version": "1.2.0",
  "audit_id": "23286913-b275-4419-b633-a4c445179fee",
  "url": "https://www.presidentsfund.gov.lk/",
  "normalized_url": "https://www.presidentsfund.gov.lk/",
  "started_at": "2026-09-05T11:48:07.470058+05:30",
  "completed_at": "2026-09-05T11:48:13.728603+05:30",
  "result": {
    "status": "fail",
    "confidence": 1.0,
    "reasons": [
      "http_available: Every repeated HTTP probe failed: [403, 403, 403, 403]"
    ]
  },
  "evidence": [
    {
      "check": "dns",
      "status": "pass",
      "detail": "Public DNS resolved",
      "observed_at": "2026-09-05T11:48:07.946205+05:30"
    },
    {
      "check": "domain_registration",
      "status": "error",
      "detail": "Domain is absent from RDAP",
      "observed_at": "2026-09-05T11:48:07.946245+05:30"
    },
    {
      "check": "tls",
      "status": "pass",
      "detail": "TLS certificate valid",
      "observed_at": "2026-09-05T11:48:08.382312+05:30"
    },
    {
      "check": "http",
      "status": "fail",
      "detail": "Probe 1: HTTP 403 at https://www.presidentsfund.gov.lk/",
      "source": "https://www.presidentsfund.gov.lk/",
      "observed_at": "2026-09-05T11:48:13.595555+05:30"
    },
    {
      "check": "http",
      "status": "fail",
      "detail": "Probe 2: HTTP 403 at https://www.presidentsfund.gov.lk/",
      "source": "http://www.presidentsfund.gov.lk/",
      "observed_at": "2026-09-05T11:48:13.595600+05:30"
    },
    {
      "check": "http",
      "status": "fail",
      "detail": "Probe 3: HTTP 403 at https://www.presidentsfund.gov.lk/",
      "source": "https://www.presidentsfund.gov.lk/",
      "observed_at": "2026-09-05T11:48:13.595616+05:30"
    },
    {
      "check": "http",
      "status": "fail",
      "detail": "Probe 4: HTTP 403 at https://www.presidentsfund.gov.lk/",
      "source": "http://www.presidentsfund.gov.lk/",
      "observed_at": "2026-09-05T11:48:13.595630+05:30"
    },
    {
      "check": "persistent_http_failure",
      "status": "fail",
      "detail": "Every repeated HTTP probe failed: [403, 403, 403, 403]",
      "observed_at": "2026-09-05T11:48:13.726560+05:30"
    },
    {
      "check": "phone",
      "status": "pass",
      "detail": "Published phone: 0-178858909",
      "source": "https://www.presidentsfund.gov.lk/",
      "data": {
        "value": "0-178858909"
      }
    },
    {
      "check": "email_in_site_domain",
      "status": "error",
      "detail": "No published email address to compare"
    },
    {
      "check": "email_domain_has_mx",
      "status": "error",
      "detail": "No published email address to check"
    }
  ],
  "observations": [
    {
      "host": "www.presidentsfund.gov.lk",
      "addresses": [
        "104.26.12.98",
        "104.26.13.98",
        "172.67.68.154"
      ],
      "status": "resolved",
      "detail": "Public DNS resolved"
    },
    {
      "domain": "presidentsfund.gov.lk",
      "status": "unknown",
      "expires_at": null,
      "detail": "Domain is absent from RDAP"
    },
    {
      "host": "www.presidentsfund.gov.lk",
      "status": "valid",
      "expires_at": "2026-10-11T20:33:07+05:30",
      "hostname_valid": true,
      "detail": "TLS certificate valid"
    },
    {
      "url": "https://www.presidentsfund.gov.lk/",
      "status_code": 403,
      "final_url": "https://www.presidentsfund.gov.lk/",
      "redirects": [],
      "elapsed_ms": 256,
      "content_type": "text/html; charset=UTF-8",
      "error": null
    },
    {
      "url": "http://www.presidentsfund.gov.lk/",
      "status_code": 403,
      "final_url": "https://www.presidentsfund.gov.lk/",
      "redirects": [
        "https://www.presidentsfund.gov.lk/"
      ],
      "elapsed_ms": 173,
      "content_type": "text/html; charset=UTF-8",
      "error": null
    },
    {
      "url": "https://www.presidentsfund.gov.lk/",
      "status_code": 403,
      "final_url": "https://www.presidentsfund.gov.lk/",
      "redirects": [],
      "elapsed_ms": 143,
      "content_type": "text/html; charset=UTF-8",
      "error": null
    },
    {
      "url": "http://www.presidentsfund.gov.lk/",
      "status_code": 403,
      "final_url": "https://www.presidentsfund.gov.lk/",
      "redirects": [
        "https://www.presidentsfund.gov.lk/"
      ],
      "elapsed_ms": 167,
      "content_type": "text/html; charset=UTF-8",
      "error": null
    }
  ],
  "snapshots": [
    {
      "url": "https://www.presidentsfund.gov.lk/",
      "path": "audit.output/www.presidentsfund.gov.lk/20260905.1148/snapshots/page-01-94ba315ed195.html",
      "sha256": "94ba315ed19540dddd9fe518cf667a49badb1c6f062f4c9764f133d28cef4085",
      "bytes": 5437
    },
    {
      "url": "https://www.presidentsfund.gov.lk/",
      "path": "audit.output/www.presidentsfund.gov.lk/20260905.1148/snapshots/page-02-e7b8b3d1aff0.html",
      "sha256": "e7b8b3d1aff0a522003a25aee5b5c6257e6f891ead160e8309e2604d6dd39dc1",
      "bytes": 5437
    },
    {
      "url": "https://www.presidentsfund.gov.lk/",
      "path": "audit.output/www.presidentsfund.gov.lk/20260905.1148/snapshots/page-03-b597c227b571.html",
      "sha256": "b597c227b571b30aeb87f07a0c99fe0dad9249df56c86ee7c4047a28828cc7a8",
      "bytes": 5437
    },
    {
      "url": "https://www.presidentsfund.gov.lk/",
      "path": "audit.output/www.presidentsfund.gov.lk/20260905.1148/snapshots/page-04-3126b5009c8f.html",
      "sha256": "3126b5009c8ff4a53a9e046848b57ec6ca017cdbe395a7928543179c67645da7",
      "bytes": 5437
    }
  ],
  "reviewer_decisions": [],
  "levels": [
    {
      "level": 0,
      "description": "A site is classified as `Level 0` when it is unavailable or unusable, or when there is not enough evidence to establish that it meets `Level 1`.",
      "status": "pass",
      "reason": "Baseline website grade",
      "executed": true,
      "checks": []
    },
    {
      "level": 1,
      "description": "To pass `Level 1`, the website must be available, usable, and clearly associated with the government institution. It must load reliably with valid DNS, HTTP, and TLS behavior.",
      "status": "fail",
      "reason": "Every repeated HTTP probe failed: [403, 403, 403, 403]",
      "executed": true,
      "checks": [
        {
          "name": "dns_resolves",
          "level": 1,
          "status": "pass",
          "reason": "Public DNS resolved"
        },
        {
          "name": "domain_not_parked",
          "level": 1,
          "status": "inconclusive",
          "reason": "No usable page was inspected"
        },
        {
          "name": "site_not_defaced",
          "level": 1,
          "status": "inconclusive",
          "reason": "No usable page was inspected"
        },
        {
          "name": "content_relevant",
          "level": 1,
          "status": "inconclusive",
          "reason": "No usable page was inspected"
        },
        {
          "name": "hosting_configured",
          "level": 1,
          "status": "inconclusive",
          "reason": "No usable page was inspected"
        },
        {
          "name": "http_available",
          "level": 1,
          "status": "fail",
          "reason": "Every repeated HTTP probe failed: [403, 403, 403, 403]"
        },
        {
          "name": "redirect_related",
          "level": 1,
          "status": "inconclusive",
          "reason": "No redirect result was available"
        },
        {
          "name": "tls_browser_trusted",
          "level": 1,
          "status": "inconclusive",
          "reason": "Browser TLS check did not complete"
        },
        {
          "name": "tls_not_expired",
          "level": 1,
          "status": "pass",
          "reason": "TLS certificate valid"
        },
        {
          "name": "tls_hostname_matches",
          "level": 1,
          "status": "pass",
          "reason": "TLS certificate valid"
        }
      ]
    },
    {
      "level": 2,
      "description": "To pass `Level 2`, citizens must be able to identify and contact the correct office for the service they need.",
      "status": "inconclusive",
      "reason": "Not run because Level 1 did not pass",
      "executed": false,
      "checks": []
    },
    {
      "level": 3,
      "description": "To pass `Level 3`, citizens must find complete and current instructions, requirements, fees, times, and usable forms.",
      "status": "inconclusive",
      "reason": "Not run because Level 2 did not pass",
      "executed": false,
      "checks": []
    },
    {
      "level": 4,
      "description": "To pass `Level 4`, citizens must be able to complete, pay for, track, and receive the outcome of a service online.",
      "status": "inconclusive",
      "reason": "Not run because Level 3 did not pass",
      "executed": false,
      "checks": []
    },
    {
      "level": 5,
      "description": "To pass `Level 5`, services must be connected across agencies, proactive for eligible citizens, explainable, and accountable.",
      "status": "inconclusive",
      "reason": "Not run because Level 4 did not pass",
      "executed": false,
      "checks": []
    }
  ]
}
