{
  "schema_version": "1.2.0",
  "audit_id": "5773fee8-7019-40d0-9494-f9cd399848d8",
  "url": "https://www.moys.gov.lk/",
  "normalized_url": "https://www.moys.gov.lk/",
  "started_at": "2026-09-05T11:35:04.015478+05:30",
  "completed_at": "2026-09-05T11:35:08.287483+05:30",
  "result": {
    "status": "inconclusive",
    "confidence": 0.5,
    "reasons": [
      "http_available: An HTTP probe was transient",
      "tls_not_expired: [Errno 61] Connection refused",
      "tls_hostname_matches: [Errno 61] Connection refused"
    ]
  },
  "evidence": [
    {
      "check": "dns",
      "status": "pass",
      "detail": "Public DNS resolved",
      "observed_at": "2026-09-05T11:35:04.425468+05:30"
    },
    {
      "check": "domain_registration",
      "status": "error",
      "detail": "Domain is absent from RDAP",
      "observed_at": "2026-09-05T11:35:04.425499+05:30"
    },
    {
      "check": "tls",
      "status": "error",
      "detail": "[Errno 61] Connection refused",
      "observed_at": "2026-09-05T11:35:04.435664+05:30"
    },
    {
      "check": "http",
      "status": "error",
      "detail": "Probe 1: [Errno 61] Connection refused",
      "source": "https://www.moys.gov.lk/",
      "observed_at": "2026-09-05T11:35:08.186921+05:30"
    },
    {
      "check": "http",
      "status": "pass",
      "detail": "Probe 2: HTTP 200 at http://www.moys.gov.lk/",
      "source": "http://www.moys.gov.lk/",
      "observed_at": "2026-09-05T11:35:08.186942+05:30"
    },
    {
      "check": "http",
      "status": "error",
      "detail": "Probe 3: [Errno 61] Connection refused",
      "source": "https://www.moys.gov.lk/",
      "observed_at": "2026-09-05T11:35:08.186947+05:30"
    },
    {
      "check": "http",
      "status": "pass",
      "detail": "Probe 4: HTTP 200 at http://www.moys.gov.lk/",
      "source": "http://www.moys.gov.lk/",
      "observed_at": "2026-09-05T11:35:08.186950+05:30"
    },
    {
      "check": "phone",
      "status": "pass",
      "detail": "Published phone: +94112697934",
      "source": "http://www.moys.gov.lk/",
      "data": {
        "value": "+94112697934"
      }
    },
    {
      "check": "email",
      "status": "pass",
      "detail": "Published email: info@moys.gov.lk",
      "source": "http://www.moys.gov.lk/",
      "data": {
        "value": "info@moys.gov.lk"
      }
    },
    {
      "check": "phone",
      "status": "pass",
      "detail": "Published phone: +94112697934",
      "source": "http://www.moys.gov.lk/",
      "data": {
        "value": "+94112697934"
      }
    },
    {
      "check": "email",
      "status": "pass",
      "detail": "Published email: info@moys.gov.lk",
      "source": "http://www.moys.gov.lk/",
      "data": {
        "value": "info@moys.gov.lk"
      }
    },
    {
      "check": "email_in_site_domain",
      "status": "fail",
      "detail": "Email domain moys.gov.lk is not part of the site domain www.moys.gov.lk"
    },
    {
      "check": "email_domain_has_mx",
      "status": "pass",
      "detail": "Found 3 MX record(s) for moys.gov.lk"
    }
  ],
  "observations": [
    {
      "host": "www.moys.gov.lk",
      "addresses": [
        "43.224.125.101"
      ],
      "status": "resolved",
      "detail": "Public DNS resolved"
    },
    {
      "domain": "moys.gov.lk",
      "status": "unknown",
      "expires_at": null,
      "detail": "Domain is absent from RDAP"
    },
    {
      "host": "www.moys.gov.lk",
      "status": "error",
      "expires_at": null,
      "hostname_valid": null,
      "detail": "[Errno 61] Connection refused"
    },
    {
      "url": "https://www.moys.gov.lk/",
      "status_code": null,
      "final_url": null,
      "redirects": [],
      "elapsed_ms": null,
      "content_type": null,
      "error": "[Errno 61] Connection refused"
    },
    {
      "url": "http://www.moys.gov.lk/",
      "status_code": 200,
      "final_url": "http://www.moys.gov.lk/",
      "redirects": [],
      "elapsed_ms": 1381,
      "content_type": "text/html; charset=UTF-8",
      "error": null
    },
    {
      "url": "https://www.moys.gov.lk/",
      "status_code": null,
      "final_url": null,
      "redirects": [],
      "elapsed_ms": null,
      "content_type": null,
      "error": "[Errno 61] Connection refused"
    },
    {
      "url": "http://www.moys.gov.lk/",
      "status_code": 200,
      "final_url": "http://www.moys.gov.lk/",
      "redirects": [],
      "elapsed_ms": 264,
      "content_type": "text/html; charset=UTF-8",
      "error": null
    }
  ],
  "snapshots": [
    {
      "url": "http://www.moys.gov.lk/",
      "path": "audit.output/www.moys.gov.lk/20260905.1135/snapshots/page-01-bc17909b6082.html",
      "sha256": "bc17909b60821342e3a6a6f85d3d75add56ab91263f2e14ecb9a45899a5041a8",
      "bytes": 285794
    },
    {
      "url": "http://www.moys.gov.lk/",
      "path": "audit.output/www.moys.gov.lk/20260905.1135/snapshots/page-02-cb7da6726dd1.html",
      "sha256": "cb7da6726dd1072ac0f5711a11ffa52758f481789c7dfc3ad0c9d2d3c5c04644",
      "bytes": 285794
    }
  ],
  "reviewer_decisions": [],
  "levels": [
    {
      "level": 0,
      "description": "A site is classified as `Level 0` when it is unavailable or unusable, or when there is not enough evidence to establish that it meets `Level 1`.",
      "status": "pass",
      "reason": "Baseline website grade",
      "executed": true,
      "checks": []
    },
    {
      "level": 1,
      "description": "To pass `Level 1`, the website must be available, usable, and clearly associated with the government institution. It must load reliably with valid DNS, HTTP, and TLS behavior.",
      "status": "inconclusive",
      "reason": "An HTTP probe was transient; [Errno 61] Connection refused; [Errno 61] Connection refused",
      "executed": true,
      "checks": [
        {
          "name": "dns_resolves",
          "level": 1,
          "status": "pass",
          "reason": "Public DNS resolved"
        },
        {
          "name": "domain_not_parked",
          "level": 1,
          "status": "pass",
          "reason": "No parked-domain marker found"
        },
        {
          "name": "site_not_defaced",
          "level": 1,
          "status": "pass",
          "reason": "No defacement marker found"
        },
        {
          "name": "content_relevant",
          "level": 1,
          "status": "pass",
          "reason": "No unrelated-content marker found"
        },
        {
          "name": "hosting_configured",
          "level": 1,
          "status": "pass",
          "reason": "No generic-hosting marker found"
        },
        {
          "name": "http_available",
          "level": 1,
          "status": "inconclusive",
          "reason": "An HTTP probe was transient"
        },
        {
          "name": "redirect_related",
          "level": 1,
          "status": "pass",
          "reason": "No unrelated redirect found"
        },
        {
          "name": "tls_browser_trusted",
          "level": 1,
          "status": "pass",
          "reason": "No browser-blocking TLS error found"
        },
        {
          "name": "tls_not_expired",
          "level": 1,
          "status": "inconclusive",
          "reason": "[Errno 61] Connection refused"
        },
        {
          "name": "tls_hostname_matches",
          "level": 1,
          "status": "inconclusive",
          "reason": "[Errno 61] Connection refused"
        }
      ]
    },
    {
      "level": 2,
      "description": "To pass `Level 2`, citizens must be able to identify and contact the correct office for the service they need.",
      "status": "inconclusive",
      "reason": "Not run because Level 1 did not pass",
      "executed": false,
      "checks": []
    },
    {
      "level": 3,
      "description": "To pass `Level 3`, citizens must find complete and current instructions, requirements, fees, times, and usable forms.",
      "status": "inconclusive",
      "reason": "Not run because Level 2 did not pass",
      "executed": false,
      "checks": []
    },
    {
      "level": 4,
      "description": "To pass `Level 4`, citizens must be able to complete, pay for, track, and receive the outcome of a service online.",
      "status": "inconclusive",
      "reason": "Not run because Level 3 did not pass",
      "executed": false,
      "checks": []
    },
    {
      "level": 5,
      "description": "To pass `Level 5`, services must be connected across agencies, proactive for eligible citizens, explainable, and accountable.",
      "status": "inconclusive",
      "reason": "Not run because Level 4 did not pass",
      "executed": false,
      "checks": []
    }
  ]
}
